download_priority_order,queue_role,country,wave,idno,documentation_file,documentation_file_name,file_size_bytes,page_count,extracted_character_count,health_terms_found,consumption_terms_found,timing_terms_found,geography_terms_found,extraction_status
5,core_selected_lsms_isa_aligned,Nigeria,2015-2016,NGA_2015_GHSP-W3_v02_M,temp/raw_downloads/NGA_2015_GHSP-W3_v02_M/PH_W3_Household_Quest.pdf,PH_W3_Household_Quest.pdf,1850071,70,106085,health; illness; medical; care; clinic; hospital,consumption; expenditure; food; non-food,interview; date; month; visit,latitude; longitude; gps; district,extracted
5,core_selected_lsms_isa_aligned,Nigeria,2015-2016,NGA_2015_GHSP-W3_v02_M,temp/raw_downloads/NGA_2015_GHSP-W3_v02_M/PP_W3_Household_Quest.pdf,PP_W3_Household_Quest.pdf,1594221,47,75687,health; illness; care,consumption; expenditure; food; non-food,interview; date; month; visit,latitude; longitude; gps,extracted
8,core_selected_lsms_isa_aligned,Tanzania,2010-2011,TZA_2010_NPS-R2_v03_M,temp/raw_downloads/TZA_2010_NPS-R2_v03_M/NPS_Household_Qx_English_Year_2.pdf,NPS_Household_Qx_English_Year_2.pdf,1121873,48,86669,health; illness; medical; care; clinic; hospital,consumption; expenditure; food; non-food,interview; date; month; visit,gps; enumeration; region; district,extracted
9,core_selected_lsms_isa_aligned,Tanzania,2012-2013,TZA_2012_NPS-R3_v01_M,temp/raw_downloads/TZA_2012_NPS-R3_v01_M/NPS_Household_Qx_Y3_Final_English.pdf,NPS_Household_Qx_Y3_Final_English.pdf,2163777,52,89586,health; illness; medical; care; clinic; hospital,consumption; expenditure; food; non-food,interview; date; month; visit,gps; enumeration; region; district,extracted
9,core_selected_lsms_isa_aligned,Tanzania,2012-2013,TZA_2012_NPS-R3_v01_M,temp/raw_downloads/TZA_2012_NPS-R3_v01_M/NPS_Wave_3 _Final _Report.pdf,NPS_Wave_3 _Final _Report.pdf,1893792,120,245665,health; illness; care; hospital,consumption; expenditure; food; non-food,interview; date; month; fieldwork; visit,gps; cluster; enumeration; region; district,extracted
