file_year_page,title,description,official_url,domain_tags,current_panel_variables_named,current_panel_variable_match_count,issue_language_in_title_or_description,audit_priority_for_current_panel,page_modified_date,http_last_modified,fetched_at_utc,snapshot_relative_path,snapshot_sha256_project_generated
2018,2018 SIPP: 2008-Comparable Recodes,User note concerning 2008-comparable recodes.,https://www.census.gov/programs-surveys/sipp/tech-documentation/user-notes/2018-usernotes/2008-comparable-recodes.html,health_insurance|income_poverty|weights_sampling|employment|education,,0,False,medium,2022-03-23T14:36:36.904-04:00,,2026-07-16T02:31:55Z,temp\source_metadata\census_sipp\user_notes\2018\2008-comparable-recodes.html,62d2625b33b630c07f075d2b4dddea9e1bee4b92b8bde2d369c74aed56c9d90b
2018,2018 SIPP: TPEARN Historical Comparison User Note,"A user note concerning, TPEARN and comparisons across SIPP panels.",https://www.census.gov/programs-surveys/sipp/tech-documentation/user-notes/2018-usernotes/2018-TPEARN-hist-comp.html,income_poverty|weights_sampling|employment|education,TFINCPOV|TFTOTINC|TPEARN|TPTOTINC,4,False,medium,2022-03-24T10:23:46.498-04:00,,2026-07-16T02:31:55Z,temp\source_metadata\census_sipp\user_notes\2018\2018-TPEARN-hist-comp.html,b6146298ca7e5847433004493c68c323ac3f51d0a92a7ca60ae5e2d22790bc0b
2018,2018 SIPP: Business Profits Collection and Processing Issue,User note discussing an error with the business profits question asking for annual profits but allowing multiple reports.,https://www.census.gov/programs-surveys/sipp/tech-documentation/user-notes/2018-usernotes/2018-bus-prof-data-coll-proc-issue.html,income_poverty|weights_sampling|employment|education,TPEARN,1,True,high,2022-03-24T14:53:15.304-04:00,,2026-07-16T02:31:54Z,temp\source_metadata\census_sipp\user_notes\2018\2018-bus-prof-data-coll-proc-issue.html,f89aa58033eb48018d7f330d4330ad4bb27797ab5aaf470604c019148c5a9bbc
2018,2018 SIPP: Changes to Asset Questions,User note concerning changes made to the asset section of the SIPP questionnaire.,https://www.census.gov/programs-surveys/sipp/tech-documentation/user-notes/2018-usernotes/2018-chg-asset-quest.html,income_poverty|weights_sampling|employment|education,,0,False,medium,2022-03-23T11:24:09.207-04:00,,2026-07-16T02:31:54Z,temp\source_metadata\census_sipp\user_notes\2018\2018-chg-asset-quest.html,70ae7d5377df6ef788039f5566b6718bea150cf4c73160a970aef1487242f191
2018,2018 SIPP: User Note for Changes to Imputed Earnings,A user note concerning changes to imputed earnings and profits.,https://www.census.gov/programs-surveys/sipp/tech-documentation/user-notes/2018-usernotes/2018-chg-imputed-earnings.html,income_poverty|weights_sampling|employment|education,,0,False,medium,2022-03-24T10:23:04.632-04:00,,2026-07-16T02:32:01Z,temp\source_metadata\census_sipp\user_notes\2018\2018-chg-imputed-earnings.html,92630fc4473e8ec5ad484e97ba95cc31280b87acfa145c66f289007d6bb9db78
2018,2018 SIPP: Child Care Assistance Universe and Allocation Rates,User note concerning the universe of child-care assistance and higher allocation rates.,https://www.census.gov/programs-surveys/sipp/tech-documentation/user-notes/2018-usernotes/2018-child-care-assist-univ-alloc-rates.html,income_poverty|weights_sampling|employment|education,,0,True,medium,2023-01-11T16:55:35.048-05:00,,2026-07-16T02:31:54Z,temp\source_metadata\census_sipp\user_notes\2018\2018-child-care-assist-univ-alloc-rates.html,895d0c3fa8e62d1d901c9f646fc3946b38da51cf474d0c470218297d3d5517ad
2018,2018 SIPP: Child Care Nursery and Head Start Variables Suppressed,Several child care nursery and Head Start arrangements variables are suppressed in 2018 SIPP.,https://www.census.gov/programs-surveys/sipp/tech-documentation/user-notes/2018-usernotes/2018-child-care-nursery-head-start-arr.html,income_poverty|weights_sampling|employment|education,,0,False,medium,2022-03-23T11:47:44.757-04:00,,2026-07-16T02:32:01Z,temp\source_metadata\census_sipp\user_notes\2018\2018-child-care-nursery-head-start-arr.html,9673721705d18f20a6afd1603091cac8cd96cf75dce2b97beda06b0f4271317a
2018,2018 SIPP: Citizenship Coding Change for American Samoans,User not concerning a change in citizenship coding for people born in American Samoa as of the 2018 SIPP.,https://www.census.gov/programs-surveys/sipp/tech-documentation/user-notes/2018-usernotes/2018-ctz-cod-chg-as.html,income_poverty|weights_sampling|employment|education,,0,False,medium,2022-03-24T12:00:36.287-04:00,,2026-07-16T02:31:56Z,temp\source_metadata\census_sipp\user_notes\2018\2018-ctz-cod-chg-as.html,18078565020e81f145c13f46a9b4d58e7f36a4ef6716eff4db01a52019d0c20a
2018,2018 SIPP: Data Issue Concerning ESPEAK and TLANG1,User note concerning errors affecting observations of ESPEAK and TLANG1,https://www.census.gov/programs-surveys/sipp/tech-documentation/user-notes/2018-usernotes/2018-data-issue-espeak-tlang1.html,income_poverty|weights_sampling|employment|education,,0,True,medium,2024-07-03T14:33:24.197-04:00,,2026-07-16T02:31:58Z,temp\source_metadata\census_sipp\user_notes\2018\2018-data-issue-espeak-tlang1.html,b80928d9468b9e9680a4a65e543a370efee370a067fe91e743fdf6be3ca60b1c
2018,2018 SIPP: Errors in Debt Allocation Flag Variable Names,"User note concerning variable names for allocation flags associated with EDEBT_CC, EDEBT_ED, EDEBT_OT, TDEBT_CC, TDEBT_ED, and TDEBT_OT.",https://www.census.gov/programs-surveys/sipp/tech-documentation/user-notes/2018-usernotes/2018-err-debt-alloc-flag-var-nam.html,income_poverty|weights_sampling|employment|education,,0,True,medium,2023-09-20T14:27:41.788-04:00,,2026-07-16T02:31:58Z,temp\source_metadata\census_sipp\user_notes\2018\2018-err-debt-alloc-flag-var-nam.html,64ff9e9f1272199a7fdf630c4101c7a5d6dacea5911a3c362f9f861015f8e84b
2018,2018 SIPP: Universe Error in Variable EMHIOTHER,User note concerning universe error in variable EMHIOTHER.,https://www.census.gov/programs-surveys/sipp/tech-documentation/user-notes/2018-usernotes/2018-error-emhiother.html,health_insurance|income_poverty|weights_sampling|employment|education,PNUM,1,True,high,2022-03-23T14:16:18.104-04:00,,2026-07-16T02:31:59Z,temp\source_metadata\census_sipp\user_notes\2018\2018-error-emhiother.html,9920aa6fe7daf2e90fb8ece12b1bbfb116fa4574e88ccef87814ec376713fd15
2018,2018 SIPP: ESPEAK Errors Affecting the Other Three Language Variables,"User note concerning misclassified ESPEAK observations affecting TLANG1, EHOWWELL, and RLNGISOL.",https://www.census.gov/programs-surveys/sipp/tech-documentation/user-notes/2018-usernotes/2018-espeak-errors.html,income_poverty|weights_sampling|employment|education,,0,True,medium,2025-07-23T11:15:26.026-04:00,,2026-07-16T02:32:00Z,temp\source_metadata\census_sipp\user_notes\2018\2018-espeak-errors.html,42e14a3598dcf2eb50f0883351a7090517a1a3e96fc28172d6d879f66f690f9e
2018,2018 SIPP: Health Insurance Marketplace Coverage,User Note concerning recode variable for Marketplace coverage.,https://www.census.gov/programs-surveys/sipp/tech-documentation/user-notes/2018-usernotes/2018-health-ins-marketpl-cov.html,health_insurance|income_poverty|weights_sampling|employment|education,RMARKTPLACE,1,False,medium,2022-03-23T14:29:56.376-04:00,,2026-07-16T02:32:01Z,temp\source_metadata\census_sipp\user_notes\2018\2018-health-ins-marketpl-cov.html,bf0b220590f9d2743091c9679bbb89439bc8f6b8bd559a4c5fec6f56c2f5e9dc
2018,2018 SIPP: Health Insurance Premium Expenditure Question Note,User note concerning health insurance premium expenditures and Social Security deductions.,https://www.census.gov/programs-surveys/sipp/tech-documentation/user-notes/2018-usernotes/2018-health-ins-prem-expd-quest-note.html,health_insurance|income_poverty|weights_sampling|employment|education,,0,False,medium,2022-12-09T10:38:43.901-05:00,,2026-07-16T02:32:01Z,temp\source_metadata\census_sipp\user_notes\2018\2018-health-ins-prem-expd-quest-note.html,2f9c53fddd5a2ac34cfa270fb7bbe0277137922c68a59e5fb409eedf424816f4
2018,2018 SIPP: Health Insurance Begin/End Month Status Flag Error,User note concerning status flag error for begin- and end-month health insurance variables.,https://www.census.gov/programs-surveys/sipp/tech-documentation/user-notes/2018-usernotes/2018-hi-month-flag-status.html,health_insurance|income_poverty|weights_sampling|employment|education,EMD_BMONTH|EMD_EMONTH,2,True,high,2025-07-23T08:49:15.444-04:00,,2026-07-16T02:32:01Z,temp\source_metadata\census_sipp\user_notes\2018\2018-hi-month-flag-status.html,812246f92f1c0beae62263f2fce2c4fe2b93db100a43939ff605038b96ba227f
2018,2018 SIPP: Unusually High Hourly Wages,User Note concerning Unusually High Hourly Wages.,https://www.census.gov/programs-surveys/sipp/tech-documentation/user-notes/2018-usernotes/2018-high-wages.html,income_poverty|weights_sampling|employment|education,TFTOTINC|THTOTINC|TPEARN|TPTOTINC,4,False,medium,2022-03-24T10:25:59.094-04:00,,2026-07-16T02:32:03Z,temp\source_metadata\census_sipp\user_notes\2018\2018-high-wages.html,7a2d0d40f81d082353253b19b26e3fde23bdf889ffe67eb55caed3aa32227776
2018,2018 SIPP: Hot-deck Allocation Error,User note concerning 2014-2022 SIPP Food Security hot-deck error.,https://www.census.gov/programs-surveys/sipp/tech-documentation/user-notes/2018-usernotes/2018-hot-deck-alloc-error.html,income_poverty|weights_sampling|employment|food_security|education,,0,True,medium,2024-12-30T11:34:08.041-05:00,,2026-07-16T02:32:03Z,temp\source_metadata\census_sipp\user_notes\2018\2018-hot-deck-alloc-error.html,e3e5acab7ba7d1c9a1eeb0c1fb36e506a87d02af5826058acd4bb256899d5126
2018,2018 SIPP: Hot Deck Corrections for Attainment Values,User note concerning correction applied to attainment hot decks for EEDUC and RGED.,https://www.census.gov/programs-surveys/sipp/tech-documentation/user-notes/2018-usernotes/2018-hot-deck-corrections.html,income_poverty|weights_sampling|employment|education,EEDUC,1,False,medium,2025-07-23T11:46:21.403-04:00,,2026-07-16T02:32:03Z,temp\source_metadata\census_sipp\user_notes\2018\2018-hot-deck-corrections.html,0c865c26e26b44dffc71be6ecaa741e4825636d5d1cb5ec03637a2da2632a0e3
2018,"2018 SIPP: Hot Deck Issues for ECERT, EPROCERT, EWHOCERT","User note concerning corrections applied to the hot decks for ECERT, EPROCERT, and EWHOCERT.",https://www.census.gov/programs-surveys/sipp/tech-documentation/user-notes/2018-usernotes/2018-hot-deck-issues.html,income_poverty|weights_sampling|employment|education,,0,False,medium,2025-07-23T12:28:09.000-04:00,,2026-07-16T02:32:04Z,temp\source_metadata\census_sipp\user_notes\2018\2018-hot-deck-issues.html,cb914e4bde4a0bb1b40da41aa1067732b1b5d1755d465d6eef0406fd0f73b587
2018,2018 SIPP: Identifying Residential Moves,User note concerning identifying residential moves.,https://www.census.gov/programs-surveys/sipp/tech-documentation/user-notes/2018-usernotes/2018-ident-res-mov.html,income_poverty|weights_sampling|employment|education,ERESIDENCEID|TMOVER|TRESDUR,3,False,medium,2022-03-24T13:23:11.183-04:00,,2026-07-16T02:32:05Z,temp\source_metadata\census_sipp\user_notes\2018\2018-ident-res-mov.html,e20effff0bd8874dd1ba5a9428325d2bc03211c33788e7abb27d47e86acf0496
2018,2018 SIPP: Improvements to Residence Data Processing as of the 2018 SIPP,User note concerning improvements in processing residence data as of the 2018 SIPP.,https://www.census.gov/programs-surveys/sipp/tech-documentation/user-notes/2018-usernotes/2018-imp-res-dat-proc.html,income_poverty|weights_sampling|employment|education,ERESIDENCEID,1,False,medium,2022-03-24T13:36:39.136-04:00,,2026-07-16T02:32:04Z,temp\source_metadata\census_sipp\user_notes\2018\2018-imp-res-dat-proc.html,dcaed9e6d4e34a51f0ab6655b724c4c781ef27efa2c549733154fe44ad055e1d
2018,2018 SIPP: Inconsistent Relationships Among People,User note concerning inconsistent relationships among people for a small number of cases.,https://www.census.gov/programs-surveys/sipp/tech-documentation/user-notes/2018-usernotes/2018-inconsistent-relationships.html,income_poverty|weights_sampling|employment|family_relationship|education,EPNSPOUSE,1,True,high,2022-03-30T08:40:54.189-04:00,,2026-07-16T02:32:06Z,temp\source_metadata\census_sipp\user_notes\2018\2018-inconsistent-relationships.html,94ab6b32f8ac75ef9468e18b1c5943aa29d360c4bca4867624f8e966f6b7dc54
2018,2018 SIPP: Incorrect Status Flags for Household Relationship Variables,User note concerning assignment of status flags for individuals who do not have a value for household relationship variables.,https://www.census.gov/programs-surveys/sipp/tech-documentation/user-notes/2018-usernotes/2018-incorr-stat-flag-hh-rel-var.html,income_poverty|weights_sampling|employment|family_relationship|education,EPNSPOUSE,1,True,high,2021-10-08T12:31:50.026-04:00,,2026-07-16T02:32:06Z,temp\source_metadata\census_sipp\user_notes\2018\2018-incorr-stat-flag-hh-rel-var.html,2317de9e8601207f782cabdaab1fe1980f12894e62da810c65f70f0571a18d5d
2018,2018 SIPP: Incorrect Universe for EWELACTV3,User note concerning an error in the universe for EWELACTV3.,https://www.census.gov/programs-surveys/sipp/tech-documentation/user-notes/2018-usernotes/2018-incorrect-universe.html,income_poverty|weights_sampling|employment|education,,0,True,medium,2022-04-11T11:47:54.791-04:00,,2026-07-16T02:32:07Z,temp\source_metadata\census_sipp\user_notes\2018\2018-incorrect-universe.html,23fd0fdd1da3623d7c6ba40b78efa3b44b92f479f318b375376729c808dd32f9
2018,2018 SIPP: Start of Dates of Jobs/Businesses,User Note concerning Start Dates of jobs/businesses.,https://www.census.gov/programs-surveys/sipp/tech-documentation/user-notes/2018-usernotes/2018-jobs.html,income_poverty|weights_sampling|employment|education,,0,False,medium,2022-03-24T10:42:37.224-04:00,,2026-07-16T02:32:07Z,temp\source_metadata\census_sipp\user_notes\2018\2018-jobs.html,06a0c8b0874e4aa2dcd30f9c1dd0864b75fe81afe2c3ae2974544d9a4a348825
2018,2018 SIPP: Jointly Held Assets and Unsecured Debts Universes,User note concerning the universes for jointly held assets and unsecured debts.,https://www.census.gov/programs-surveys/sipp/tech-documentation/user-notes/2018-usernotes/2018-jointly-held-assets-and-unsecured-debts-universes.html,income_poverty|weights_sampling|employment|education,EMS|MONTHCODE,2,False,medium,2023-08-09T08:17:41.947-04:00,,2026-07-16T02:32:07Z,temp\source_metadata\census_sipp\user_notes\2018\2018-jointly-held-assets-and-unsecured-debts-universes.html,c4cc82fe3b561006b122c577e3cbecb91d8987b83e31f4bc9482fe50f9bde551
2018,2018 SIPP: Medicaid End-Month Variable Error,User note concerning processing error that affects Medicaid spell end-month variable.,https://www.census.gov/programs-surveys/sipp/tech-documentation/user-notes/2018-usernotes/2018-medicaid-variable-error.html,health_insurance|income_poverty|weights_sampling|employment|education,EMD_BMONTH|EMD_EMONTH|MONTHCODE,3,True,high,2025-07-22T17:51:36.714-04:00,,2026-07-16T02:32:11Z,temp\source_metadata\census_sipp\user_notes\2018\2018-medicaid-variable-error.html,6621a9f8b2a19f2b5a9a7a2b761bf7b457e85f8a716409a612abc3654e5e3d15
2018,2018 SIPP: Model-based Imputation of Asset Variables,User note concerning changes to the imputation of asset variables.,https://www.census.gov/programs-surveys/sipp/tech-documentation/user-notes/2018-usernotes/2018-mod-bas-impute-ass-var.html,income_poverty|weights_sampling|employment|education,,0,False,medium,2022-03-23T11:20:07.614-04:00,,2026-07-16T02:32:08Z,temp\source_metadata\census_sipp\user_notes\2018\2018-mod-bas-impute-ass-var.html,8a4ef10deff9246a1606d14a6186d5c678c72e81c2f3cb37294f97b81ab0cfd5
2018,2018 SIPP: Monthly Health Insurance Variables Error,"User note concerning processing error that affects monthly Medicare, Medicaid, and Other health coverage.",https://www.census.gov/programs-surveys/sipp/tech-documentation/user-notes/2018-usernotes/2018-monthly-hi-variables-error.html,health_insurance|income_poverty|weights_sampling|employment|education,ECRMTH|EMDMTH|EMD_BMONTH|EMD_EMONTH|MONTHCODE|RHLTHMTH|RPRIMTH|RPUBMTH|RPUBTYPE1|RPUBTYPE2,10,True,high,2025-07-23T18:24:13.487-04:00,,2026-07-16T02:32:09Z,temp\source_metadata\census_sipp\user_notes\2018\2018-monthly-hi-variables-error.html,0efe3e20ee99b22cd92e73969bed4785a1ed0c0cfd1772542120277f99a6c146
2018,2018 SIPP: Reasons Did Not Have Private and/or Public Health Insurance Coverage,User note concerning reasons respondent did not have private and/or public health insurance coverage for at least one month.,https://www.census.gov/programs-surveys/sipp/tech-documentation/user-notes/2018-usernotes/2018-no-health-insurance.html,health_insurance|income_poverty|weights_sampling|employment|education,,0,False,medium,2022-03-23T14:31:38.669-04:00,,2026-07-16T02:32:09Z,temp\source_metadata\census_sipp\user_notes\2018\2018-no-health-insurance.html,68342b6b438cc546c6f13b2133afa754f7845d3410635bf88830c52a7a215f05
2018,2018 SIPP: ‘Other Jobs’ Section,User Note concerning &lsquo;Other Jobs&rsquo; section data.,https://www.census.gov/programs-surveys/sipp/tech-documentation/user-notes/2018-usernotes/2018-other-jobs-section.html,income_poverty|weights_sampling|employment|education,RMESR|TPEARN,2,False,medium,2022-03-24T10:24:49.425-04:00,,2026-07-16T02:32:10Z,temp\source_metadata\census_sipp\user_notes\2018\2018-other-jobs-section.html,26d6d9f22fabdf0b5410b93e26109f0f7c347a4987d699d0cb35b5798d90b46c
2018,2018 SIPP: Other Assistance Universe and Logical-Imputation Rates,"User note concerning some annual, means-tested program assistance universes and logical-imputation rates.",https://www.census.gov/programs-surveys/sipp/tech-documentation/user-notes/2018-usernotes/2018-othr-assist-univ-logical-imput-rates.html,income_poverty|weights_sampling|employment|food_security|education,,0,False,medium,2023-01-11T16:39:14.948-05:00,,2026-07-16T02:32:09Z,temp\source_metadata\census_sipp\user_notes\2018\2018-othr-assist-univ-logical-imput-rates.html,23b6abf369f07ec13d7fcd1af7d078770f7d45a6697b3b87170620481c0074ca
2018,2018 SIPP: Other Health Insurance Coverage Reports,User Note concerning interpretation of &lsquo;Other Coverage&rsquo; reports.,https://www.census.gov/programs-surveys/sipp/tech-documentation/user-notes/2018-usernotes/2018-othr-health-ins-cov-report.html,health_insurance|income_poverty|weights_sampling|employment|education,,0,False,medium,2022-03-23T11:14:15.501-04:00,,2026-07-16T02:32:11Z,temp\source_metadata\census_sipp\user_notes\2018\2018-othr-health-ins-cov-report.html,67362f8134a642f7ccb8980a124d4b1065a9e8d0657a74c4fdea35f2ee5338db
2018,2018 SIPP: “Other Support Paid” Universe,User note concerning an error in the universe of &ldquo;Other Support Paid&rdquo;.,https://www.census.gov/programs-surveys/sipp/tech-documentation/user-notes/2018-usernotes/2018-othr-supprt-paid-univ.html,income_poverty|weights_sampling|employment|education,TAGE_EHC,1,True,high,2023-01-31T10:53:47.028-05:00,,2026-07-16T02:32:11Z,temp\source_metadata\census_sipp\user_notes\2018\2018-othr-supprt-paid-univ.html,14e286fcf1079e3697a5e9ea6e396b34bf48958fc22175effbc571f44f22db50
2018,2018 SIPP: Pass-Through Child Support Universe Error,User note concerning an error in the universe for the receipt of pass-through child support variable.,https://www.census.gov/programs-surveys/sipp/tech-documentation/user-notes/2018-usernotes/2018-pass-thr-child-supprt-univ-error.html,income_poverty|weights_sampling|employment|education,,0,True,medium,2025-03-11T13:46:33.430-04:00,,2026-07-16T02:32:13Z,temp\source_metadata\census_sipp\user_notes\2018\2018-pass-thr-child-supprt-univ-error.html,f0dea7727b98d75b960e86219510275a734651ba3486df7cb9f5453f47171b84
2018,2018 SIPP: Problems with Fertility Status Flag Universes,User note concerning inconsistencies between a respondent&rsquo;s universe status in fertility variables and their corresponding status flags.,https://www.census.gov/programs-surveys/sipp/tech-documentation/user-notes/2018-usernotes/2018-prob-fertility-stat-flg.html,income_poverty|weights_sampling|employment|family_relationship|education,,0,True,medium,2022-03-23T14:02:06.101-04:00,,2026-07-16T02:32:12Z,temp\source_metadata\census_sipp\user_notes\2018\2018-prob-fertility-stat-flg.html,9eee69e994fdd485327ce3ee3adb1b7d582ba816a33111b488a11799e9c62e44
2018,2018 SIPP: Problems with Registered Domestic Partnership Data,User note concerning a small number of cases with inconsistent cohabiting partner and registered domestic partnership info.,https://www.census.gov/programs-surveys/sipp/tech-documentation/user-notes/2018-usernotes/2018-prob-reg-dom-prs-data.html,income_poverty|weights_sampling|employment|family_relationship|education,,0,True,medium,2022-03-24T11:13:41.573-04:00,,2026-07-16T02:32:14Z,temp\source_metadata\census_sipp\user_notes\2018\2018-prob-reg-dom-prs-data.html,9d50e10681356a0cf5ae2868c0743561f15e9b46c90126010cd51ecb442a5441
2018,2018 SIPP: Problem with Shared Fertility Histories,User note concerning inconsistencies between fertility histories of two members of a childbearing couple.,https://www.census.gov/programs-surveys/sipp/tech-documentation/user-notes/2018-usernotes/2018-prob-shared-fertility-hist.html,income_poverty|weights_sampling|employment|family_relationship|education,,0,True,medium,2022-03-23T14:04:14.794-04:00,,2026-07-16T02:32:15Z,temp\source_metadata\census_sipp\user_notes\2018\2018-prob-shared-fertility-hist.html,e9ac93a04654a49fae3392a60d36fd50a08953ab6109a76a38ae71cb1f89e8d0
2018,2018 SIPP: Problems with Marital History Data,User note concerning inconsistencies between a respondent&rsquo;s monthly marital status during the reference period and other marital history variables.,https://www.census.gov/programs-surveys/sipp/tech-documentation/user-notes/2018-usernotes/2018-problem-marital-data.html,income_poverty|weights_sampling|employment|family_relationship|education,,0,True,medium,2022-03-24T11:11:12.770-04:00,,2026-07-16T02:32:14Z,temp\source_metadata\census_sipp\user_notes\2018\2018-problem-marital-data.html,3e4c3e2d0e1bf2f387856e5be93bf56e0d0c56875910756f1a0f6afbace06040
2018,2018 SIPP: Processing Error Effects on Uninsured Care,User note concerning effects of processing error in monthly health insurance variables on Uninsured Care.,https://www.census.gov/programs-surveys/sipp/tech-documentation/user-notes/2018-usernotes/2018-processing-error-effects.html,health_insurance|income_poverty|weights_sampling|employment|education,,0,True,medium,2025-07-23T19:15:49.009-04:00,,2026-07-16T02:32:14Z,temp\source_metadata\census_sipp\user_notes\2018\2018-processing-error-effects.html,b468e315473e59c0420a8538cf976fc3b963ce50d97130be417b1332412d19ee
2018,2018 SIPP: Incorrect Metadata for Reason SSI Receipt Began,User note concerning originally published metadata for the reason SSI receipt began.,https://www.census.gov/programs-surveys/sipp/tech-documentation/user-notes/2018-usernotes/2018-reason-ssi-recpt-answ-catg.html,income_poverty|weights_sampling|employment|education,,0,True,medium,2022-03-24T12:30:01.232-04:00,,2026-07-16T02:32:16Z,temp\source_metadata\census_sipp\user_notes\2018\2018-reason-ssi-recpt-answ-catg.html,7b82624423bf9a560b6e3d4db0cd5c8423352ce25a81db560faa2f15527813fc
2018,2018 SIPP: Recode Allocation Flags,User Note concerning recode allocation flags.,https://www.census.gov/programs-surveys/sipp/tech-documentation/user-notes/2018-usernotes/2018-recode-flags.html,income_poverty|weights_sampling|employment|education,TPEARN,1,True,high,2022-03-24T10:25:24.134-04:00,,2026-07-16T02:32:17Z,temp\source_metadata\census_sipp\user_notes\2018\2018-recode-flags.html,f3990bb62f77ae3cc9bafd577c13140bfbb69c41821197ce943fa3268e272db7
2018,2018 SIPP: Registered Domestic Partnership Allocation Flag,User note concerning allocation flag values for registered domestic partnership variable (AREGDOMPART).,https://www.census.gov/programs-surveys/sipp/tech-documentation/user-notes/2018-usernotes/2018-reg-dom-partshp-alloc-flag.html,income_poverty|weights_sampling|employment|education,,0,True,medium,2022-03-24T11:15:45.361-04:00,,2026-07-16T02:32:16Z,temp\source_metadata\census_sipp\user_notes\2018\2018-reg-dom-partshp-alloc-flag.html,93d0505d78dfea4a1411869d9c4f494c53acc26c1b7630860be96573392616a2
2018,2018 SIPP: “_SCRNR” Health Insurance Variables Versus Recodes,User note advising against the use of health insurance &ldquo;_SCRNR&rdquo; variables in favor of using recodes.,https://www.census.gov/programs-surveys/sipp/tech-documentation/user-notes/2018-usernotes/2018-scrnr-health-ins-var-vs-recodes.html,health_insurance|income_poverty|weights_sampling|employment|education,RPRIMTH|RPRITYPE1|RPRITYPE2|RPUBMTH|RPUBTYPE1|RPUBTYPE2|RPUBTYPE3,7,False,medium,2022-12-07T12:10:38.579-05:00,,2026-07-16T02:32:17Z,temp\source_metadata\census_sipp\user_notes\2018\2018-scrnr-health-ins-var-vs-recodes.html,f0508d7d92bd0fdc55fe47fe8d8c23f54c85b98676dcd305fa1731af7e4a5660
2018,2018 SIPP: Social Security Parent-Child Linkage Variables,User note concerning variables that can be used to link children with adults receiving Social Security on behalf of a child.,https://www.census.gov/programs-surveys/sipp/tech-documentation/user-notes/2018-usernotes/2018-social-security-parent-child-linkage-variable.html,health_insurance|income_poverty|weights_sampling|employment|family_relationship|education,PNUM,1,False,medium,2024-07-09T17:26:27.881-04:00,,2026-07-16T02:32:20Z,temp\source_metadata\census_sipp\user_notes\2018\2018-social-security-parent-child-linkage-variable.html,6bed6e186a5d1713ab3d1db4cea9744951193cd70235127721baf2be90ca0653
2018,2018 SIPP: Status Flag Error for Miscellaneous Income,User note concerning status flag error for &ldquo;any miscellaneous income&rdquo; receipt.,https://www.census.gov/programs-surveys/sipp/tech-documentation/user-notes/2018-usernotes/2018-status-flag-error.html,income_poverty|weights_sampling|employment|education,,0,True,medium,2024-07-01T13:39:47.136-04:00,,2026-07-16T02:32:17Z,temp\source_metadata\census_sipp\user_notes\2018\2018-status-flag-error.html,1e2d34178861d983773eb9ee562661b1864a0d9a2b1b3615716596ead2ad1e9f
