mechanism_pathway,causal_role,minimum_inputs,timing_rule,allowed_analysis,prohibited_use,current_status,evidence_required_before_claim,interpretation_if_unavailable_or_failed
income_consumption_decline,mediator_or_secondary_outcome,"total consumption or income, household ID, survey timing, climate geography",consumption/income must be measured after or during the shock exposure window; never include as a main-effect control if post-shock,separate reduced-form model of climate shock on consumption/income; heterogeneity descriptor only if pre-shock,do not control for post-shock consumption/income in the main UHC failure climate-effect model,partially_ready_requires_pathway_specific_audit,"raw variable values, units, recall periods, deflators if used, timing relative to exposure, and household-level lineage",economic mechanism unsupported for that country-wave; do not force a pathway claim
food_insecurity,mediator_or_secondary_outcome,"food insecurity, crop/food shock, coping, or livelihood variables plus verified timing and geography",food insecurity must be contemporaneous or post-exposure; pre-exposure food security may be a moderator if clearly pre-shock,separate pathway model and subgroup description where modules support the construct,do not relabel general asset or agriculture variables as food insecurity without raw wording support,partially_ready_requires_pathway_specific_audit,"raw questionnaire wording, response categories, recall period, and value distribution",food insecurity pathway remains untested in that country-wave
health_need_illness,mediator_or_secondary_outcome,"illness, injury, symptoms, or health-need denominator with verified recall period",need window must be compatible with climate exposure lag; future need cannot be used to define treatment,climate shock to health-need reduced-form pathway and need-denominator audit,do not mix person-level and household-level need denominators without explicit aggregation,partially_ready_requires_pathway_specific_audit,"raw skip patterns, denominator, recall period, person/household level, and missing-value handling",health-need channel cannot be separated from access or financial-protection outcomes
forgone_care_after_need,access_outcome_and_pathway,"health need denominator, care sought/not sought, and cost/distance/supply barrier variables",care-seeking module must refer to the same need episode or compatible recall period,access outcome model and pathway decomposition by barrier type,do not infer forgone care for households without observed health need unless module supports it,partially_ready_requires_pathway_specific_audit,"raw skip pattern, barrier response coding, multiple-response handling, and denominator checks",access pathway is unavailable; keep double-failure outcome secondary or omit for that wave
oop_share_conditional_on_seeking,financial_protection_pathway,"OOP health expenditure, total consumption/income, and preferably care-seeking/utilization",OOP and budget recall periods must be reconciled or kept as recall-specific outcomes,"OOP share or log OOP among seekers, with denominator caveats",do not annualize or standardize incompatible recall periods without documented justification,partially_ready_requires_pathway_specific_audit,"OOP scope, reimbursement/insurance treatment, recall period, currency unit, zero/missing coding, and denominator unit",financial-spending pathway cannot be interpreted beyond metadata planning
coping_response_to_health_or_climate,secondary_outcome_or_mechanism,"borrowing, selling assets, reducing consumption, or other coping responses with reason/timing",coping must be tied to health spending or climate shock timing; otherwise label as broad vulnerability,separate coping outcome or descriptive vulnerability moderator if pre-shock,do not treat generic borrowing/sales as health-cost coping without raw reason codes,partially_ready_requires_pathway_specific_audit,"reason for coping, timing, value coding, multiple-response handling, and relation to health/climate module",coping mechanism remains speculative and must be omitted from mechanism claims
uhc_double_failure_composite,composite_outcome,financial-protection denominator and access/need denominator in the same country-wave,financial and access recall periods must be reported separately if not comparable,composite UHC failure only after financial and access components pass independent audits,do not pool financial and access failures across country-waves where component definitions are not comparable,partially_ready_requires_pathway_specific_audit,"constructed CHE/SDG outcomes, forgone-care outcomes, event rates, missingness, and weighted prevalence",double-failure outcome remains secondary or unavailable; analyze financial and access outcomes separately
