country,wave,idno,requirement,mechanical_raw_check_decision,final_verification_decision,acceptance_evidence,remaining_blocker,next_action,data_write_gate_effect
Malawi,2004-2005,MWI_2004_IHS-II_v01_M,household_person_keys,raw_value_verified_access_person_key_exclusion_policy_accepted,raw_value_verified_for_access_person_universe_with_documented_exclusions,household/exp/pov case_id joins pass; health->roster unmatched=6; roster->health unmatched=2; exception_status=policy_pending_exception_unresolved; access_resolution_status=access_person_keys_and_cost_barrier_forgone_care_verified_with_documented_exclusions; nonroster_d04_yes=0; nonroster_no_money=0.,Accepted for the stated access person-universe scope only; raw IDs are not exported and no access outcomes are imputed for roster-only health absences.,Keep the documented exclusion/no-imputation policy attached to any Malawi 2004 access or double-failure use.,does_not_open_data_gate
Malawi,2004-2005,MWI_2004_IHS-II_v01_M,weights_and_design,raw_value_verified_financial_policy_accepted,raw_value_verified_for_che10_che25,hhwght positive=11280/11280; strata=30; health psu=564; household_financial_rows=11280; financial_policy_status=che10_che25_financial_inputs_verified_sdg382_blocked.,"Household financial survey design is accepted for CHE10/CHE25; recheck person-level design and cross-country modeling design before access, double-failure, or ML use.",Keep household financial design fixed for CHE10/CHE25; verify person-level/access design separately before double-failure promotion.,does_not_open_data_gate
Malawi,2004-2005,MWI_2004_IHS-II_v01_M,consumption_or_income,raw_value_verified_che_denominator_sdg_policy_blocked,raw_value_verified_for_che10_che25,rexpagg positive=11280/11280; povline and price_index are present; household_financial_rows=11280; che10_rows=208; che25_rows=17; sdg382_ready=0.,rexpagg is accepted as CHE10/CHE25 total-budget denominator; SDG 3.8.2 societal poverty-line/discretionary-budget mapping remains blocked.,Resolve SDG 3.8.2 discretionary-budget policy separately; do not use SDG status for promotion yet.,does_not_open_data_gate
Malawi,2004-2005,MWI_2004_IHS-II_v01_M,oop_health_expenditure,raw_value_verified_oop_aggregate_policy_accepted,raw_value_verified_for_che10_che25,rexp_cat06 nonmissing=11280/11280; component diff<=0.01 rows=11280/11280; max diff=0.00294495; financial_policy_status=che10_che25_financial_inputs_verified_sdg382_blocked.,rexp_cat06 is accepted as annual household health OOP aggregate for CHE10/CHE25; health-module recall spending remains context only.,Keep rexp_cat06 as the CHE OOP input; do not substitute person-level health-module recall sums for household CHE.,does_not_open_data_gate
Malawi,2004-2005,MWI_2004_IHS-II_v01_M,health_need_and_access,raw_value_verified_access_person_key_policy_accepted,raw_value_verified_for_cost_barrier_forgone_care,d04 illness yes rows=14143; d07 no-money label hits=660; label_decision_rows=127; label_no_money_rows=660; accepted_denominator=14143; accepted_no_money_rows=631; formal_core=5130; formal_extended=5593; skip_leakage_rows=6; policy_skip_exceptions=6; skip_exception_no_money=0; d07a_leak_overlap_with_nonroster=0; explained_by_nonroster=0; access_resolution_status=access_person_keys_and_cost_barrier_forgone_care_verified_with_documented_exclusions.,Cost-barrier forgone care is accepted only for roster-matched d04==Yes rows with documented exclusions; distance/supply barriers and full nonfinancial access taxonomy remain out of scope.,"Use the accepted access/person-key policy for double-failure readiness, but do not write promoted data until missing/units/recall and climate-route gates pass.",does_not_open_data_gate
Malawi,2004-2005,MWI_2004_IHS-II_v01_M,survey_timing,raw_value_verified_interview_month_policy_accepted,raw_value_verified_for_climate_timing,idate converts to 2004-03-08 through 2005-03-31; policy_dates=2004-03-08 through 2005-03-31; interview_month_count=13; timing_geography_status=raw_timing_admin_ea_geography_verified_climate_route_blocked.,Interview-month timing is accepted for climate-window review; climate values still require an accepted CHIRPS/ERA5 route.,Use interview-month anchors when defining CHIRPS/ERA5 exposure windows; do not run extraction until geography route is accepted.,does_not_open_data_gate
Malawi,2004-2005,MWI_2004_IHS-II_v01_M,climate_geography,raw_value_verified_admin_ea_geography_route_blocked,raw_value_verified_for_admin_ea_geography,household dist+ta+ea keys=564; matched to EA file=564; policy_household_ea_match=564/564; no GPS coordinate field accepted; accepted_chirps_era5_route=0.,"Raw admin/EA geography is accepted, but CHIRPS/ERA5 route remains blocked until boundary/crosswalk and aggregation policy are documented.",Define the boundary/crosswalk and exposure aggregation route for CHIRPS/ERA5 without treating EA/admin fields as coordinates.,does_not_open_data_gate
Malawi,2004-2005,MWI_2004_IHS-II_v01_M,missing_codes_units_recall_skip_patterns,raw_value_verified_missing_units_recall_skip_policy_accepted,raw_value_verified_for_missing_units_recall_skip_patterns,Raw value labels and profiles exist; missing_units_recall_skip_policy_status=raw_missing_units_recall_skip_policy_verified_for_accepted_constructs; financial_units_verified=1; access_units_recall_skip_verified=1; timing_units_verified=1; geography_units_verified=1.,"Accepted for CHE10/CHE25, cost-barrier access, timing, and admin/EA geography scope; SDG 3.8.2 and CHIRPS/ERA5 route remain separate blockers.",Proceed to CHIRPS/ERA5 route and promoted synthesis review; do not write data while climate route is blocked.,does_not_open_data_gate
